{
  "$schema": "https://json-schema.org/draft/2020-12/schema",
  "$id": "https://shroodler.local/schema/finding.schema.json",
  "title": "Shroodler crawl output",
  "type": "object",
  "additionalProperties": false,
  "required": [
    "target",
    "scan_started_at",
    "scan_finished_at",
    "crawler",
    "pages",
    "findings",
    "js_endpoints"
  ],
  "properties": {
    "schema_version": {
      "type": "string",
      "pattern": "^[0-9]+\\.[0-9]+\\.[0-9]+$",
      "description": "Version of this schema the document was produced against, e.g. \"1.1.0\". Absent on documents produced before this field existed; consumers should treat a missing value as \"1.0.0\". Bump the minor version for additive, backward-compatible changes (new optional field, new enum value) and the major version for breaking changes."
    },
    "target": {
      "type": "string",
      "minLength": 1,
      "description": "Base URL that was crawled"
    },
    "scan_started_at": {
      "type": "string",
      "format": "date-time"
    },
    "scan_finished_at": {
      "type": "string",
      "format": "date-time"
    },
    "crawler": {
      "type": "object",
      "additionalProperties": false,
      "required": ["name", "version", "mode"],
      "properties": {
        "name": { "type": "string", "minLength": 1 },
        "version": { "type": "string", "minLength": 1 },
        "mode": { "type": "string", "enum": ["static", "headless", "ingest"] }
      }
    },
    "pages": {
      "type": "array",
      "items": { "$ref": "#/$defs/page" }
    },
    "findings": {
      "type": "array",
      "items": { "$ref": "#/$defs/finding" }
    },
    "js_endpoints": {
      "type": "array",
      "items": { "$ref": "#/$defs/js_endpoint" }
    },
    "edges": {
      "type": "array",
      "description": "Links this crawl followed. kind is html (an HTML link), redirect, or form (a form action). Absent on crawls recorded before this field existed.",
      "items": { "$ref": "#/$defs/edge" }
    },
    "unfetched": {
      "type": "array",
      "description": "Linked URLs the crawl recorded but did not open because it stopped early (time or page limit). Absent when the crawl finished or on older files.",
      "items": { "type": "string", "minLength": 1 }
    },
    "xhr_endpoints": {
      "type": "array",
      "items": { "$ref": "#/$defs/xhr_endpoint" },
      "description": "Optional XHR/fetch pairs intercepted during a headless crawl. Absent on older scans."
    },
    "stats": {
      "$ref": "#/$defs/stats",
      "description": "Optional crawl metrics. Absent on older scans; not required."
    }
  },
  "$defs": {
    "page": {
      "type": "object",
      "additionalProperties": false,
      "required": [
        "url",
        "status_code",
        "forms",
        "params",
        "cookies",
        "headers",
        "js_files"
      ],
      "properties": {
        "url": { "type": "string", "minLength": 1 },
        "status_code": { "type": "integer", "minimum": 0, "maximum": 599 },
        "forms": {
          "type": "array",
          "items": { "$ref": "#/$defs/form" }
        },
        "params": {
          "type": "array",
          "items": { "type": "string" }
        },
        "cookies": {
          "type": "array",
          "items": { "$ref": "#/$defs/cookie" }
        },
        "headers": { "$ref": "#/$defs/header_analysis" },
        "js_files": {
          "type": "array",
          "items": { "type": "string" }
        }
      }
    },
    "form": {
      "type": "object",
      "additionalProperties": false,
      "required": ["action", "method", "fields"],
      "properties": {
        "action": { "type": "string" },
        "method": { "type": "string" },
        "enctype": { "type": ["string", "null"] },
        "fields": {
          "type": "array",
          "items": { "$ref": "#/$defs/form_field" }
        }
      }
    },
    "form_field": {
      "type": "object",
      "additionalProperties": false,
      "required": ["name", "type", "hidden"],
      "properties": {
        "name": { "type": "string" },
        "type": { "type": "string" },
        "hidden": { "type": "boolean" },
        "disabled": { "type": ["boolean", "null"] },
        "readonly": { "type": ["boolean", "null"] }
      }
    },
    "cookie": {
      "type": "object",
      "additionalProperties": false,
      "required": ["name", "secure", "http_only", "same_site"],
      "properties": {
        "name": { "type": "string" },
        "secure": { "type": "boolean" },
        "http_only": { "type": "boolean" },
        "same_site": {
          "type": ["string", "null"],
          "enum": ["Strict", "Lax", "None", null]
        }
      }
    },
    "header_analysis": {
      "type": "object",
      "additionalProperties": false,
      "required": ["present", "missing"],
      "properties": {
        "present": {
          "type": "array",
          "items": { "type": "string" }
        },
        "missing": {
          "type": "array",
          "items": { "type": "string" }
        }
      }
    },
    "finding": {
      "type": "object",
      "additionalProperties": false,
      "required": ["id", "severity", "category", "url", "description", "evidence"],
      "properties": {
        "id": { "type": "string", "minLength": 1 },
        "severity": {
          "type": "string",
          "enum": ["info", "low", "medium", "high", "critical"]
        },
        "category": {
          "type": "string",
          "description": "\"payload\" covers all active payload-tester findings (SQLi/XSS/SSTI/path-traversal/SSRF/open-redirect/XXE); the specific vulnerability class is carried in the finding's \"id\" (e.g. payload-sql-error, payload-ssrf, payload-open-redirect), not a separate category value. \"scan-note\" is not a vulnerability; it is used to record that an active probe (e.g. CORS reflection, GraphQL introspection) was intentionally skipped, so consumers do not silently interpret an empty result as \"checked, nothing found\". \"auth\" covers authentication/session/authorization findings that aren't a single HTTP header or cookie -- missing rate limiting, session fixation, logout not invalidating the session, and cross-session/IDOR access -- again disambiguated by the finding's \"id\". \"waf-challenge\" flags a response that looks like a WAF/bot-mitigation challenge or interstitial page (Cloudflare, Akamai, PerimeterX, DataDome, a CAPTCHA wall, etc.) rather than real target content; when present, other checks against that same URL were not meaningfully performed. \"smart-contract\" is reserved for findings translated from Slither via slither-ingest; \"sast\" is reserved for findings folded in from an external SARIF file via report --merge-sarif.",
          "enum": [
            "header",
            "cookie",
            "secret",
            "exposed-file",
            "js-endpoint",
            "verbose-error",
            "autocomplete",
            "payload",
            "scan-note",
            "auth",
            "waf-challenge",
            "subresource",
            "tls",
            "smart-contract",
            "sast"
          ]
        },
        "url": { "type": "string", "minLength": 1 },
        "description": { "type": "string" },
        "evidence": { "type": ["string", "null"] },
        "confidence": {
          "type": "string",
          "enum": ["confirmed", "probable", "heuristic"],
          "description": "Optional. How this finding was established: \"confirmed\" for an exact/unambiguous signal (an echoed marker string matched verbatim, a secret pattern matched literally), \"probable\" for a strong-but-inferential signal (blind/timing-based payload confirmation), \"heuristic\" for a passive check that flags a likely-but-unverified condition (a missing header, a suspicious comment). Absent on findings produced before this field existed or by checks that don't yet classify themselves."
        },
        "cost_of_attack": {
          "type": "string",
          "enum": ["none", "low", "medium", "high"],
          "description": "Optional. How much an attacker needs beyond network access to exploit this: \"none\" (unauthenticated), \"low\" (a low-entropy/guessable token or a throwaway account), \"medium\" (a valid authenticated session), \"high\" (privileged/admin access or a high-entropy secret). A cross-cutting axis alongside severity, not a replacement for it."
        },
        "minimal_repro": {
          "type": "boolean",
          "description": "Optional. True when \"evidence\" holds the smallest payload variant found to still trigger this finding (binary-searched down from the full pack), rather than whichever payload happened to match first."
        },
        "engines": {
          "type": "array",
          "items": { "type": "string", "enum": ["python", "go"] },
          "description": "Optional, legacy. Which crawler engine(s) independently reproduced this exact finding (same id+url). Produced by the retired `shroodler compare-engines` differential; no longer populated now that Go is the sole crawl engine. Still accepted so historical scan documents validate."
        },
        "severity_disagreement": {
          "type": "object",
          "additionalProperties": false,
          "properties": {
            "python": { "type": "array", "items": { "type": "string" } },
            "go": { "type": "array", "items": { "type": "string" } }
          },
          "description": "Optional, legacy. Was set by the retired `shroodler compare-engines` differential when both engines reproduced this (id, path, query) with different severities. No longer populated now that Go is the sole crawl engine; still accepted so historical scan documents validate."
        },
        "owner": {
          "type": "string",
          "description": "Optional. Team/individual responsible for remediating this finding, resolved from an ownership-rules file by `shroodler sla apply` (same id/url glob matching as .shroodlerignore)."
        },
        "first_seen": {
          "type": ["string", "null"],
          "description": "Optional. Date (YYYY-MM-DD) this finding (by id+url) first appeared in recorded scan history, set by `shroodler sla apply`. Null when history_available is false (not enough recorded history to determine this, NOT the same as 'first seen today')."
        },
        "age_days": {
          "type": ["integer", "null"],
          "minimum": 0,
          "description": "Optional. Days since first_seen, set by `shroodler sla apply`. Null when first_seen is null."
        },
        "sla_severity": {
          "type": "string",
          "enum": ["info", "low", "medium", "high", "critical"],
          "description": "Optional. Severity after SLA escalation (bumped up one level once age_days exceeds the SLA budget for the original severity, capped at critical). Equal to \"severity\" until the SLA burns down, and always equal to \"severity\" when history_available is false."
        },
        "sla_breached": {
          "type": "boolean",
          "description": "Optional. True once age_days has exceeded the SLA budget for this finding's original severity, set by `shroodler sla apply`. Always false when history_available is false -- absence of history is not evidence of a clean SLA."
        },
        "history_available": {
          "type": "boolean",
          "description": "Optional. False when `shroodler sla apply` found zero recorded scans for this target in history (missing/empty history dir, or wrong target) -- age_days/sla_breached could not be meaningfully evaluated, as opposed to being evaluated and clean."
        }
      }
    },
    "edge": {
      "type": "object",
      "additionalProperties": false,
      "required": ["from_url", "to_url", "kind"],
      "properties": {
        "from_url": { "type": "string", "minLength": 1 },
        "to_url": { "type": "string", "minLength": 1 },
        "kind": { "type": "string", "enum": ["html", "redirect", "form"] }
      }
    },
    "js_endpoint": {
      "type": "object",
      "additionalProperties": false,
      "required": ["source", "endpoint"],
      "properties": {
        "source": { "type": "string" },
        "endpoint": { "type": "string" }
      }
    },
    "xhr_endpoint": {
      "type": "object",
      "additionalProperties": false,
      "required": ["url", "method"],
      "properties": {
        "url": { "type": "string", "minLength": 1 },
        "method": { "type": "string", "minLength": 1 },
        "params": {
          "type": "array",
          "items": { "$ref": "#/$defs/xhr_param" }
        }
      }
    },
    "xhr_param": {
      "type": "object",
      "additionalProperties": false,
      "required": ["name"],
      "properties": {
        "name": { "type": "string", "minLength": 1 },
        "value": { "type": "string" },
        "in": { "type": "string" }
      }
    },
    "stats": {
      "type": "object",
      "additionalProperties": false,
      "properties": {
        "pages_crawled": {
          "type": "number",
          "minimum": 0,
          "description": "Number of pages recorded in pages[]"
        },
        "pages_challenged": {
          "type": "number",
          "minimum": 0,
          "description": "Number of distinct URLs where a waf-challenge finding fired -- these pages were not meaningfully inspected (forms/secrets/JS-endpoints/etc. were not extracted from them). Absent on documents produced before this field existed; treat a missing value as 0. A high ratio of this against pages_crawled means the scan's other findings substantially understate the target's real attack surface."
        },
        "requests": {
          "type": "number",
          "minimum": 0,
          "description": "HTTP requests issued during the crawl, when counted"
        },
        "elapsed_ms": {
          "type": "number",
          "minimum": 0,
          "description": "Wall time from crawl start to finish in milliseconds"
        },
        "stopped_reason": {
          "type": "string",
          "enum": ["complete", "max-pages", "max-time"],
          "description": "Why the crawl stopped enqueueing more work"
        }
      }
    }
  }
}
