{
  "target": "http://127.0.0.1:8081",
  "scan_started_at": "2026-09-01T12:00:00Z",
  "scan_finished_at": "2026-09-01T12:00:02Z",
  "crawler": { "name": "shroodler-py", "version": "0.1.0", "mode": "static" },
  "pages": [
    {
      "url": "http://127.0.0.1:8081/",
      "status_code": 200,
      "forms": [],
      "params": [],
      "cookies": [],
      "headers": { "present": ["X-Frame-Options"], "missing": ["Content-Security-Policy"] },
      "js_files": ["/static/app.js"]
    },
    {
      "url": "http://127.0.0.1:8081/login",
      "status_code": 200,
      "forms": [
        {
          "action": "/login",
          "method": "POST",
          "fields": [
            { "name": "username", "type": "text", "hidden": false },
            { "name": "password", "type": "password", "hidden": false }
          ]
        }
      ],
      "params": [],
      "cookies": [],
      "headers": { "present": [], "missing": ["Content-Security-Policy"] },
      "js_files": []
    },
    {
      "url": "http://127.0.0.1:8081/settings",
      "status_code": 200,
      "forms": [],
      "params": ["tab"],
      "cookies": [],
      "headers": { "present": [], "missing": [] },
      "js_files": []
    }
  ],
  "findings": [
    {
      "id": "missing-csp",
      "severity": "medium",
      "category": "header",
      "url": "http://127.0.0.1:8081/login",
      "description": "Content-Security-Policy header not set",
      "evidence": null
    },
    {
      "id": "server-version-leak",
      "severity": "info",
      "category": "header",
      "url": "http://127.0.0.1:8081/",
      "description": "Server header discloses version",
      "evidence": null
    }
  ],
  "js_endpoints": []
}
