{
  "target": "https://www.etoro.com/",
  "scan_started_at": "2026-09-07T18:25:51Z",
  "scan_finished_at": "2026-09-07T18:28:44Z",
  "crawler": {
    "name": "shroodler-py",
    "version": "0.2.0",
    "mode": "static"
  },
  "pages": [],
  "findings": [],
  "js_endpoints": [],
  "stats": {
    "pages_crawled": 0,
    "pages_challenged": 0,
    "requests": 12,
    "elapsed_ms": 172622,
    "stopped_reason": "max-time"
  }
}
